{"contractVersion":"prospective-fixture-assessment/1.0","prospectiveRunId":"run","assessmentSetHash":"aaaaaaaaaaaaaaaaaaaaaaaaaaaaaaaaaaaaaaaaaaaaaaaaaaaaaaaaaaaaaaaa","assessments":[{"id":"a","prospectiveRunId":"run","matchDecisionId":"m","sportsDate":"2026-07-23","fixtureIdentity":{"forebetObservationId":"f","statareaRowId":"s","homeTeamRaw":"Home","awayTeamRaw":"Away","competitionRaw":null,"countryRaw":null,"scheduledKickoffRaw":null},"dcCandidateId":null,"ouCandidateId":null,"combinationCandidateId":null,"prePricePreference":null,"prePriceSecondAlternative":null,"prePriceSelectionStatus":"NONE","prePriceScoreMargin":null,"priceEvaluationStatus":"NOT_CAPTURED","decisionFrozenAt":"2026-07-22T12:00:00.000Z","warnings":[]}]}
